opt/matmul.log
{"i": ["cuda", "logsummul", ["float32"], {}, ["logsummul", "float32"], {"i": 204, "t": "", "c": null, "e": [["y_bn", "ot", 32], ["x_bn", "ot", 128], ["y_t", "ot", 32], ["x_t", "ot", 32], ["k_split", "ot", 2]]}], "r": [[0.0408803506], 0, 2.8020691871643066, 1580014098.7551394], "v": 0.1}
{"i": ["cuda", "logsummul", ["float32"], {}, ["logsummul", "float32"], {"i": 249, "t": "", "c": null, "e": [["y_bn", "ot", 32], ["x_bn", "ot", 128], ["y_t", "ot", 8], ["x_t", "ot", 4], ["k_split", "ot", 8]]}], "r": [[0.044754549399999996], 0, 2.9353816509246826, 1580014100.5272048], "v": 0.1}
{"i": ["cuda", "logsummul", ["float32"], {}, ["logsummul", "float32"], {"i": 363, "t": "", "c": null, "e": [["y_bn", "ot", 32], ["x_bn", "ot", 64], ["y_t", "ot", 32], ["x_t", "ot", 4], ["k_split", "ot", 16]]}], "r": [[0.042252700500000004], 0, 2.9356796741485596, 1580014102.2862368], "v": 0.1}
{"i": ["cuda", "logsummul", ["float32"], {}, ["logsummul", "float32"], {"i": 70, "t": "", "c": null, "e": [["y_bn", "ot", 64], ["x_bn", "ot", 128], ["y_t", "ot", 32], ["x_t", "ot", 8], ["k_split", "ot", 1]]}], "r": [[0.029607161700000002], 0, 2.4519684314727783, 1580014103.6862068], "v": 0.1}
{"i": ["cuda", "logsummul", ["float32"], {}, ["logsummul", "float32"], {"i": 370, "t": "", "c": null, "e": [["y_bn", "ot", 64], ["x_bn", "ot", 32], ["y_t", "ot", 64], ["x_t", "ot", 4], ["k_split", "ot", 16]]}], "r": [[0.0420216625], 0, 2.851848840713501, 1580014105.480785], "v": 0.1}
{"i": ["cuda", "logsummul", ["float32"], {}, ["logsummul", "float32"], {"i": 387, "t": "", "c": null, "e": [["y_bn", "ot", 32], ["x_bn", "ot", 32], ["y_t", "ot", 32], ["x_t", "ot", 8], ["k_split", "ot", 16]]}], "r": [[0.08037175690000001], 0, 3.7275009155273438, 1580014109.5131261], "v": 0.1}
{"i": ["cuda", "logsummul", ["float32"], {}, ["logsummul", "float32"], {"i": 46, "t": "", "c": null, "e": [["y_bn", "ot", 64], ["x_bn", "ot", 32], ["y_t", "ot", 64], ["x_t", "ot", 4], ["k_split", "ot", 1]]}], "r": [[0.025399273500000003], 0, 2.22223162651062, 1580014110.7878883], "v": 0.1}
{"i": ["cuda", "logsummul", ["float32"], {}, ["logsummul", "float32"], {"i": 43, "t": "", "c": null, "e": [["y_bn", "ot", 64], ["x_bn", "ot", 128], ["y_t", "ot", 32], ["x_t", "ot", 4], ["k_split", "ot", 1]]}], "r": [[0.0272299075], 0, 2.3741419315338135, 1580014112.183866], "v": 0.1}
{"i": ["cuda", "logsummul", ["float32"], {}, ["logsummul", "float32"], {"i": 58, "t": "", "c": null, "e": [["y_bn", "ot", 64], ["x_bn", "ot", 64], ["y_t", "ot", 8], ["x_t", "ot", 8], ["k_split", "ot", 1]]}], "r": [[0.021926178499999997], 0, 2.1043272018432617, 1580014113.354594], "v": 0.1}
{"i": ["cuda", "logsummul", ["float32"], {}, ["logsummul", "float32"], {"i": 71, "t": "", "c": null, "e": [["y_bn", "ot", 128], ["x_bn", "ot", 128], ["y_t", "ot", 32], ["x_t", "ot", 8], ["k_split", "ot", 1]]}], "r": [[0.028440976], 0, 2.3014769554138184, 1580014116.0093062], "v": 0.1}
{"i": ["cuda", "logsummul", ["float32"], {}, ["logsummul", "float32"], {"i": 194, "t": "", "c": null, "e": [["y_bn", "ot", 128], ["x_bn", "ot", 64], ["y_t", "ot", 8], ["x_t", "ot", 32], ["k_split", "ot", 2]]}], "r": [[0.024157551899999997], 0, 2.257662296295166, 1580014117.2454119], "v": 0.1}
{"i": ["cuda", "logsummul", ["float32"], {}, ["logsummul", "float32"], {"i": 342, "t": "", "c": null, "e": [["y_bn", "ot", 32], ["x_bn", "ot", 32], ["y_t", "ot", 64], ["x_t", "ot", 2], ["k_split", "ot", 16]]}], "r": [[0.05088190769999999], 0, 2.921259641647339, 1580014119.309641], "v": 0.1}
{"i": ["cuda", "logsummul", ["float32"], {}, ["logsummul", "float32"], {"i": 276, "t": "", "c": null, "e": [["y_bn", "ot", 32], ["x_bn", "ot", 128], ["y_t", "ot", 8], ["x_t", "ot", 8], ["k_split", "ot", 8]]}], "r": [[0.026685471300000003], 0, 2.579972743988037, 1580014120.7495856], "v": 0.1}
{"i": ["cuda", "logsummul", ["float32"], {}, ["logsummul", "float32"], {"i": 63, "t": "", "c": null, "e": [["y_bn", "ot", 32], ["x_bn", "ot", 32], ["y_t", "ot", 32], ["x_t", "ot", 8], ["k_split", "ot", 1]]}], "r": [[0.0314582883], 0, 2.3340306282043457, 1580014123.7482429], "v": 0.1}
{"i": ["cuda", "logsummul", ["float32"], {}, ["logsummul", "float32"], {"i": 289, "t": "", "c": null, "e": [["y_bn", "ot", 64], ["x_bn", "ot", 32], ["y_t", "ot", 64], ["x_t", "ot", 8], ["k_split", "ot", 8]]}], "r": [[0.0818663727], 0, 4.097866535186768, 1580014126.7929394], "v": 0.1}
{"i": ["cuda", "logsummul", ["float32"], {}, ["logsummul", "float32"], {"i": 144, "t": "", "c": null, "e": [["y_bn", "ot", 32], ["x_bn", "ot", 32], ["y_t", "ot", 32], ["x_t", "ot", 4], ["k_split", "ot", 2]]}], "r": [[0.0253852056], 0, 2.2328784465789795, 1580014128.0380201], "v": 0.1}
{"i": ["cuda", "logsummul", ["float32"], {}, ["logsummul", "float32"], {"i": 88, "t": "", "c": null, "e": [["y_bn", "ot", 64], ["x_bn", "ot", 128], ["y_t", "ot", 8], ["x_t", "ot", 32], ["k_split", "ot", 1]]}], "r": [[0.0325238796], 0, 2.724993944168091, 1580014129.5418143], "v": 0.1}
{"i": ["cuda", "logsummul", ["float32"], {}, ["logsummul", "float32"], {"i": 338, "t": "", "c": null, "e": [["y_bn", "ot", 128], ["x_bn", "ot", 64], ["y_t", "ot", 32], ["x_t", "ot", 2], ["k_split", "ot", 16]]}], "r": [[0.0428515362], 0, 3.1114470958709717, 1580014131.3114629], "v": 0.1}
{"i": ["cuda", "logsummul", ["float32"], {}, ["logsummul", "float32"], {"i": 268, "t": "", "c": null, "e": [["y_bn", "ot", 64], ["x_bn", "ot", 128], ["y_t", "ot", 64], ["x_t", "ot", 4], ["k_split", "ot", 8]]}], "r": [[0.0441879063], 0, 2.8786332607269287, 1580014134.9854963], "v": 0.1}
{"i": ["cuda", "logsummul", ["float32"], {}, ["logsummul", "float32"], {"i": 150, "t": "", "c": null, "e": [["y_bn", "ot", 32], ["x_bn", "ot", 128], ["y_t", "ot", 32], ["x_t", "ot", 4], ["k_split", "ot", 2]]}], "r": [[0.0434851526], 0, 2.9259097576141357, 1580014136.8897257], "v": 0.1}
{"i": ["cuda", "logsummul", ["float32"], {}, ["logsummul", "float32"], {"i": 341, "t": "", "c": null, "e": [["y_bn", "ot", 128], ["x_bn", "ot", 128], ["y_t", "ot", 32], ["x_t", "ot", 2], ["k_split", "ot", 16]]}], "r": [[0.24043418989999998], 0, 9.807045459747314, 1580014145.0852044], "v": 0.1}
{"i": ["cuda", "logsummul", ["float32"], {}, ["logsummul", "float32"], {"i": 242, "t": "", "c": null, "e": [["y_bn", "ot", 128], ["x_bn", "ot", 128], ["y_t", "ot", 64], ["x_t", "ot", 2], ["k_split", "ot", 8]]}], "r": [[0.0564212284], 0, 3.83402943611145, 1580014147.7496266], "v": 0.1}
{"i": ["cuda", "logsummul", ["float32"], {}, ["logsummul", "float32"], {"i": 3, "t": "", "c": null, "e": [["y_bn", "ot", 32], ["x_bn", "ot", 64], ["y_t", "ot", 8], ["x_t", "ot", 2], ["k_split", "ot", 1]]}], "r": [[0.08669984280000001], 0, 4.477212429046631, 1580014151.0624304], "v": 0.1}
{"i": ["cuda", "logsummul", ["float32"], {}, ["logsummul", "float32"], {"i": 180, "t": "", "c": null, "e": [["y_bn", "ot", 32], ["x_bn", "ot", 32], ["y_t", "ot", 64], ["x_t", "ot", 8], ["k_split", "ot", 2]]}], "r": [[0.07127171730000001], 0, 3.6764469146728516, 1580014155.4111993], "v": 0.1}
{"i": ["cuda", "logsummul", ["float32"], {}, ["logsummul", "float32"], {"i": 243, "t": "", "c": null, "e": [["y_bn", "ot", 32], ["x_bn", "ot", 32], ["y_t", "ot", 8], ["x_t", "ot", 4], ["k_split", "ot", 8]]}], "r": [[0.0209884745], 0, 2.054896593093872, 1580014156.5244741], "v": 0.1}
{"i": ["cuda", "logsummul", ["float32"], {}, ["logsummul", "float32"], {"i": 90, "t": "", "c": null, "e": [["y_bn", "ot", 32], ["x_bn", "ot", 32], ["y_t", "ot", 32], ["x_t", "ot", 32], ["k_split", "ot", 1]]}], "r": [[0.1150740925], 0, 5.328544616699219, 1580014171.4487395], "v": 0.1}
{"i": ["cuda", "logsummul", ["float32"], {}, ["logsummul", "float32"], {"i": 407, "t": "", "c": null, "e": [["y_bn", "ot", 128], ["x_bn", "ot", 32], ["y_t", "ot", 8], ["x_t", "ot", 32], ["k_split", "ot", 16]]}], "r": [[0.0193189226], 0, 2.2065277099609375, 1580014174.217194], "v": 0.1}
{"i": ["cuda", "logsummul", ["float32"], {}, ["logsummul", "float32"], {"i": 108, "t": "", "c": null, "e": [["y_bn", "ot", 32], ["x_bn", "ot", 32], ["y_t", "ot", 8], ["x_t", "ot", 2], ["k_split", "ot", 2]]}], "r": [[0.0444519383], 0, 3.1195294857025146, 1580014176.1996732], "v": 0.1}
{"i": ["cuda", "logsummul", ["float32"], {}, ["logsummul", "float32"], {"i": 371, "t": "", "c": null, "e": [["y_bn", "ot", 128], ["x_bn", "ot", 32], ["y_t", "ot", 64], ["x_t", "ot", 4], ["k_split", "ot", 16]]}], "r": [[0.030040271], 0, 2.4412529468536377, 1580014177.590094], "v": 0.1}
{"i": ["cuda", "logsummul", ["float32"], {}, ["logsummul", "float32"], {"i": 89, "t": "", "c": null, "e": [["y_bn", "ot", 128], ["x_bn", "ot", 128], ["y_t", "ot", 8], ["x_t", "ot", 32], ["k_split", "ot", 1]]}], "r": [[0.035173612300000004], 0, 2.6486239433288574, 1580014179.2301223], "v": 0.1}
{"i": ["cuda", "logsummul", ["float32"], {}, ["logsummul", "float32"], {"i": 218, "t": "", "c": null, "e": [["y_bn", "ot", 128], ["x_bn", "ot", 32], ["y_t", "ot", 8], ["x_t", "ot", 2], ["k_split", "ot", 8]]}], "r": [[0.2619372922], 0, 11.552242994308472, 1580014201.2404757], "v": 0.1}
{"i": ["cuda", "logsummul", ["float32"], {}, ["logsummul", "float32"], {"i": 285, "t": "", "c": null, "e": [["y_bn", "ot", 32], ["x_bn", "ot", 128], ["y_t", "ot", 32], ["x_t", "ot", 8], ["k_split", "ot", 8]]}], "r": [[0.0825748271], 0, 4.188318729400635, 1580014204.3296623], "v": 0.1}
{"i": ["cuda", "logsummul", ["float32"], {}, ["logsummul", "float32"], {"i": 110, "t": "", "c": null, "e": [["y_bn", "ot", 128], ["x_bn", "ot", 32], ["y_t", "ot", 8], ["x_t", "ot", 2], ["k_split", "ot", 2]]}], "r": [[0.30845283710000004], 0, 11.735260725021362, 1580014214.5281782], "v": 0.1}
{"i": ["cuda", "logsummul", ["float32"], {}, ["logsummul", "float32"], {"i": 65, "t": "", "c": null, "e": [["y_bn", "ot", 128], ["x_bn", "ot", 32], ["y_t", "ot", 32], ["x_t", "ot", 8], ["k_split", "ot", 1]]}], "r": [[0.0216613212], 0, 2.168344497680664, 1580014215.669015], "v": 0.1}
{"i": ["cuda", "logsummul", ["float32"], {}, ["logsummul", "float32"], {"i": 270, "t": "", "c": null, "e": [["y_bn", "ot", 32], ["x_bn", "ot", 32], ["y_t", "ot", 8], ["x_t", "ot", 8], ["k_split", "ot", 8]]}], "r": [[0.0297987014], 0, 2.504395008087158, 1580014217.0637095], "v": 0.1}
{"i": ["cuda", "logsummul", ["float32"], {}, ["logsummul", "float32"], {"i": 141, "t": "", "c": null, "e": [["y_bn", "ot", 32], ["x_bn", "ot", 128], ["y_t", "ot", 8], ["x_t", "ot", 4], ["k_split", "ot", 2]]}], "r": [[0.051413254500000005], 0, 3.267313241958618, 1580014220.493752], "v": 0.1}
{"i": ["cuda", "logsummul", ["float32"], {}, ["logsummul", "float32"], {"i": 31, "t": "", "c": null, "e": [["y_bn", "ot", 64], ["x_bn", "ot", 64], ["y_t", "ot", 8], ["x_t", "ot", 4], ["k_split", "ot", 1]]}], "r": [[0.0486132822], 0, 3.442795991897583, 1580014222.7071586], "v": 0.1}
{"i": ["cuda", "logsummul", ["float32"], {}, ["logsummul", "float32"], {"i": 311, "t": "", "c": null, "e": [["y_bn", "ot", 128], ["x_bn", "ot", 64], ["y_t", "ot", 32], ["x_t", "ot", 32], ["k_split", "ot", 8]]}], "r": [[0.0277181061], 0, 2.485532760620117, 1580014224.1119688], "v": 0.1}
{"i": ["cuda", "logsummul", ["float32"], {}, ["logsummul", "float32"], {"i": 22, "t": "", "c": null, "e": [["y_bn", "ot", 64], ["x_bn", "ot", 64], ["y_t", "ot", 64], ["x_t", "ot", 2], ["k_split", "ot", 1]]}], "r": [[0.0202027124], 0, 2.036273241043091, 1580014225.2447803], "v": 0.1}
{"i": ["cuda", "logsummul", ["float32"], {}, ["logsummul", "float32"], {"i": 283, "t": "", "c": null, "e": [["y_bn", "ot", 64], ["x_bn", "ot", 64], ["y_t", "ot", 32], ["x_t", "ot", 8], ["k_split", "ot", 8]]}], "r": [[0.0423556114], 0, 2.945154905319214, 1580014227.0949452], "v": 0.1}
{"i": ["cuda", "logsummul", ["float32"], {}, ["logsummul", "float32"], {"i": 278, "t": "", "c": null, "e": [["y_bn", "ot", 128], ["x_bn", "ot", 128], ["y_t", "ot", 8], ["x_t", "ot", 8], ["k_split", "ot", 8]]}], "r": [[0.22870170339999998], 0, 9.165846109390259, 1580014236.4236574], "v": 0.1}
{"i": ["cuda", "logsummul", ["float32"], {}, ["logsummul", "float32"], {"i": 161, "t": "", "c": null, "e": [["y_bn", "ot", 128], ["x_bn", "ot", 128], ["y_t", "ot", 64], ["x_t", "ot", 4], ["k_split", "ot", 2]]}], "r": [[0.0315509528], 0, 2.670894145965576, 1580014237.9443123], "v": 0.1}
{"i": ["cuda", "logsummul", ["float32"], {}, ["logsummul", "float32"], {"i": 408, "t": "", "c": null, "e": [["y_bn", "ot", 32], ["x_bn", "ot", 64], ["y_t", "ot", 8], ["x_t", "ot", 32], ["k_split", "ot", 16]]}], "r": [[0.034464183100000004], 0, 2.6124634742736816, 1580014239.4757023], "v": 0.1}
{"i": ["cuda", "logsummul", ["float32"], {}, ["logsummul", "float32"], {"i": 76, "t": "", "c": null, "e": [["y_bn", "ot", 64], ["x_bn", "ot", 64], ["y_t", "ot", 64], ["x_t", "ot", 8], ["k_split", "ot", 1]]}], "r": [[0.0369896383], 0, 2.6976840496063232, 1580014241.1314344], "v": 0.1}
{"i": ["cuda", "logsummul", ["float32"], {}, ["logsummul", "float32"], {"i": 380, "t": "", "c": null, "e": [["y_bn", "ot", 128], ["x_bn", "ot", 32], ["y_t", "ot", 8], ["x_t", "ot", 8], ["k_split", "ot", 16]]}], "r": [[0.0186423816], 0, 2.0967869758605957, 1580014242.171085], "v": 0.1}
{"i": ["cuda", "logsummul", ["float32"], {}, ["logsummul", "float32"], {"i": 55, "t": "", "c": null, "e": [["y_bn", "ot", 64], ["x_bn", "ot", 32], ["y_t", "ot", 8], ["x_t", "ot", 8], ["k_split", "ot", 1]]}], "r": [[0.022505002399999998], 0, 2.3452770709991455, 1580014244.8176982], "v": 0.1}
{"i": ["cuda", "logsummul", ["float32"], {}, ["logsummul", "float32"], {"i": 166, "t": "", "c": null, "e": [["y_bn", "ot", 64], ["x_bn", "ot", 64], ["y_t", "ot", 8], ["x_t", "ot", 8], ["k_split", "ot", 2]]}], "r": [[0.0204259296], 0, 2.32004976272583, 1580014246.030608], "v": 0.1}
{"i": ["cuda", "logsummul", ["float32"], {}, ["logsummul", "float32"], {"i": 280, "t": "", "c": null, "e": [["y_bn", "ot", 64], ["x_bn", "ot", 32], ["y_t", "ot", 32], ["x_t", "ot", 8], ["k_split", "ot", 8]]}], "r": [[0.0428390511], 0, 2.948012113571167, 1580014247.870129], "v": 0.1}
{"i": ["cuda", "logsummul", ["float32"], {}, ["logsummul", "float32"], {"i": 421, "t": "", "c": null, "e": [["y_bn", "ot", 64], ["x_bn", "ot", 128], ["y_t", "ot", 32], ["x_t", "ot", 32], ["k_split", "ot", 16]]}], "r": [[0.06446334649999999], 0, 3.404637575149536, 1580014250.2862325], "v": 0.1}
{"i": ["cuda", "logsummul", ["float32"], {}, ["logsummul", "float32"], {"i": 348, "t": "", "c": null, "e": [["y_bn", "ot", 32], ["x_bn", "ot", 128], ["y_t", "ot", 64], ["x_t", "ot", 2], ["k_split", "ot", 16]]}], "r": [[0.1595679665], 0, 6.722032070159912, 1580014255.770343], "v": 0.1}
{"i": ["cuda", "logsummul", ["float32"], {}, ["logsummul", "float32"], {"i": 300, "t": "", "c": null, "e": [["y_bn", "ot", 32], ["x_bn", "ot", 64], ["y_t", "ot", 8], ["x_t", "ot", 32], ["k_split", "ot", 8]]}], "r": [[0.0227142016], 0, 1.971639633178711, 1580014258.040524], "v": 0.1}
{"i": ["cuda", "logsummul", ["float32"], {}, ["logsummul", "float32"], {"i": 186, "t": "", "c": null, "e": [["y_bn", "ot", 32], ["x_bn", "ot", 128], ["y_t", "ot", 64], ["x_t", "ot", 8], ["k_split", "ot", 2]]}], "r": [[0.1998377128], 0, 7.6713056564331055, 1580014264.7723367], "v": 0.1}
{"i": ["cuda", "logsummul", ["float32"], {}, ["logsummul", "float32"], {"i": 355, "t": "", "c": null, "e": [["y_bn", "ot", 64], ["x_bn", "ot", 64], ["y_t", "ot", 8], ["x_t", "ot", 4], ["k_split", "ot", 16]]}], "r": [[0.0483764458], 0, 2.956918478012085, 1580014266.9580452], "v": 0.1}
{"i": ["cuda", "logsummul", ["float32"], {}, ["logsummul", "float32"], {"i": 95, "t": "", "c": null, "e": [["y_bn", "ot", 128], ["x_bn", "ot", 64], ["y_t", "ot", 32], ["x_t", "ot", 32], ["k_split", "ot", 1]]}], "r": [[0.0459714253], 0, 2.834691047668457, 1580014270.151827], "v": 0.1}
{"i": ["cuda", "logsummul", ["float32"], {}, ["logsummul", "float32"], {"i": 41, "t": "", "c": null, "e": [["y_bn", "ot", 128], ["x_bn", "ot", 64], ["y_t", "ot", 32], ["x_t", "ot", 4], ["k_split", "ot", 1]]}], "r": [[0.021703118599999998], 0, 2.2665085792541504, 1580014271.2829325], "v": 0.1}
{"i": ["cuda", "logsummul", ["float32"], {}, ["logsummul", "float32"], {"i": 271, "t": "", "c": null, "e": [["y_bn", "ot", 64], ["x_bn", "ot", 32], ["y_t", "ot", 8], ["x_t", "ot", 8], ["k_split", "ot", 8]]}], "r": [[0.0213394537], 0, 2.389296293258667, 1580014272.5242527], "v": 0.1}
{"i": ["cuda", "logsummul", ["float32"], {}, ["logsummul", "float32"], {"i": 361, "t": "", "c": null, "e": [["y_bn", "ot", 64], ["x_bn", "ot", 32], ["y_t", "ot", 32], ["x_t", "ot", 4], ["k_split", "ot", 16]]}], "r": [[0.027892228600000003], 0, 2.314927816390991, 1580014273.803833], "v": 0.1}
{"i": ["cuda", "logsummul", ["float32"], {}, ["logsummul", "float32"], {"i": 192, "t": "", "c": null, "e": [["y_bn", "ot", 32], ["x_bn", "ot", 64], ["y_t", "ot", 8], ["x_t", "ot", 32], ["k_split", "ot", 2]]}], "r": [[0.0273700832], 0, 2.272540807723999, 1580014275.141474], "v": 0.1}
{"i": ["cuda", "logsummul", ["float32"], {}, ["logsummul", "float32"], {"i": 205, "t": "", "c": null, "e": [["y_bn", "ot", 64], ["x_bn", "ot", 128], ["y_t", "ot", 32], ["x_t", "ot", 32], ["k_split", "ot", 2]]}], "r": [[0.035437973299999995], 0, 2.316589593887329, 1580014277.890344], "v": 0.1}
{"i": ["cuda", "logsummul", ["float32"], {}, ["logsummul", "float32"], {"i": 246, "t": "", "c": null, "e": [["y_bn", "ot", 32], ["x_bn", "ot", 64], ["y_t", "ot", 8], ["x_t", "ot", 4], ["k_split", "ot", 8]]}], "r": [[0.020461384399999998], 0, 1.8776283264160156, 1580014278.982469], "v": 0.1}
{"i": ["cuda", "logsummul", ["float32"], {}, ["logsummul", "float32"], {"i": 117, "t": "", "c": null, "e": [["y_bn", "ot", 32], ["x_bn", "ot", 32], ["y_t", "ot", 32], ["x_t", "ot", 2], ["k_split", "ot", 2]]}], "r": [[0.0184796689], 0, 1.9498529434204102, 1580014279.9978206], "v": 0.1}
{"i": ["cuda", "logsummul", ["float32"], {}, ["logsummul", "float32"], {"i": 339, "t": "", "c": null, "e": [["y_bn", "ot", 32], ["x_bn", "ot", 128], ["y_t", "ot", 32], ["x_t", "ot", 2], ["k_split", "ot", 16]]}], "r": [[0.0247155285], 0, 2.2877097129821777, 1580014282.4784226], "v": 0.1}
{"i": ["cuda", "logsummul", ["float32"], {}, ["logsummul", "float32"], {"i": 28, "t": "", "c": null, "e": [["y_bn", "ot", 64], ["x_bn", "ot", 32], ["y_t", "ot", 8], ["x_t", "ot", 4], ["k_split", "ot", 1]]}], "r": [[0.0232026597], 0, 2.4126501083374023, 1580014283.7672443], "v": 0.1}
{"i": ["cuda", "logsummul", ["float32"], {}, ["logsummul", "float32"], {"i": 303, "t": "", "c": null, "e": [["y_bn", "ot", 32], ["x_bn", "ot", 128], ["y_t", "ot", 8], ["x_t", "ot", 32], ["k_split", "ot", 8]]}], "r": [[0.0656686365], 0, 3.6727545261383057, 1580014286.3349524], "v": 0.1}
{"i": ["cuda", "logsummul", ["float32"], {}, ["logsummul", "float32"], {"i": 267, "t": "", "c": null, "e": [["y_bn", "ot", 32], ["x_bn", "ot", 128], ["y_t", "ot", 64], ["x_t", "ot", 4], ["k_split", "ot", 8]]}], "r": [[0.0923179385], 0, 4.45205020904541, 1580014289.6893241], "v": 0.1}
{"i": ["cuda", "logsummul", ["float32"], {}, ["logsummul", "float32"], {"i": 132, "t": "", "c": null, "e": [["y_bn", "ot", 32], ["x_bn", "ot", 128], ["y_t", "ot", 64], ["x_t", "ot", 2], ["k_split", "ot", 2]]}], "r": [[0.21190474899999998], 0, 8.11240839958191, 1580014296.7248516], "v": 0.1}
{"i": ["cuda", "logsummul", ["float32"], {}, ["logsummul", "float32"], {"i": 253, "t": "", "c": null, "e": [["y_bn", "ot", 64], ["x_bn", "ot", 32], ["y_t", "ot", 32], ["x_t", "ot", 4], ["k_split", "ot", 8]]}], "r": [[0.0249248405], 0, 2.148832082748413, 1580014299.217029], "v": 0.1}
{"i": ["cuda", "logsummul", ["float32"], {}, ["logsummul", "float32"], {"i": 0, "t": "", "c": null, "e": [["y_bn", "ot", 32], ["x_bn", "ot", 32], ["y_t", "ot", 8], ["x_t", "ot", 2], ["k_split", "ot", 1]]}], "r": [[0.0397167235], 0, 2.760756492614746, 1580014301.0349004], "v": 0.1}
{"i": ["cuda", "logsummul", ["float32"], {}, ["logsummul", "float32"], {"i": 237, "t": "", "c": null, "e": [["y_bn", "ot", 32], ["x_bn", "ot", 64], ["y_t", "ot", 64], ["x_t", "ot", 2], ["k_split", "ot", 8]]}], "r": [[0.0524919635], 0, 3.1556894779205322, 1580014303.1611626], "v": 0.1}
{"i": ["cuda", "logsummul", ["float32"], {}, ["logsummul", "float32"], {"i": 399, "t": "", "c": null, "e": [["y_bn", "ot", 32], ["x_bn", "ot", 64], ["y_t", "ot", 64], ["x_t", "ot", 8], ["k_split", "ot", 16]]}], "r": [[0.1665699469], 0, 6.5504138469696045, 1580014308.8352435], "v": 0.1}
{"i": ["cuda", "logsummul", ["float32"], {}, ["logsummul", "float32"], {"i": 25, "t": "", "c": null, "e": [["y_bn", "ot", 64], ["x_bn", "ot", 128], ["y_t", "ot", 64], ["x_t", "ot", 2], ["k_split", "ot", 1]]}], "r": [[0.023277016], 0, 2.4147727489471436, 1580014311.4207332], "v": 0.1}
{"i": ["cuda", "logsummul", ["float32"], {}, ["logsummul", "float32"], {"i": 84, "t": "", "c": null, "e": [["y_bn", "ot", 32], ["x_bn", "ot", 64], ["y_t", "ot", 8], ["x_t", "ot", 32], ["k_split", "ot", 1]]}], "r": [[0.0480857619], 0, 3.104987859725952, 1580014313.3976893], "v": 0.1}
{"i": ["cuda", "logsummul", ["float32"], {}, ["logsummul", "float32"], {"i": 188, "t": "", "c": null, "e": [["y_bn", "ot", 128], ["x_bn", "ot", 128], ["y_t", "ot", 64], ["x_t", "ot", 8], ["k_split", "ot", 2]]}], "r": [[0.049133395600000004], 0, 3.125926971435547, 1580014315.3751261], "v": 0.1}
{"i": ["cuda", "logsummul", ["float32"], {}, ["logsummul", "float32"], {"i": 123, "t": "", "c": null, "e": [["y_bn", "ot", 32], ["x_bn", "ot", 128], ["y_t", "ot", 32], ["x_t", "ot", 2], ["k_split", "ot", 2]]}], "r": [[0.031587424600000004], 0, 2.5188419818878174, 1580014316.7587378], "v": 0.1}
{"i": ["cuda", "logsummul", ["float32"], {}, ["logsummul", "float32"], {"i": 153, "t": "", "c": null, "e": [["y_bn", "ot", 32], ["x_bn", "ot", 32], ["y_t", "ot", 64], ["x_t", "ot", 4], ["k_split", "ot", 2]]}], "r": [[0.0635235509], 0, 3.518219232559204, 1580014319.1262329], "v": 0.1}
{"i": ["cuda", "logsummul", ["float32"], {}, ["logsummul", "float32"], {"i": 385, "t": "", "c": null, "e": [["y_bn", "ot", 64], ["x_bn", "ot", 128], ["y_t", "ot", 8], ["x_t", "ot", 8], ["k_split", "ot", 16]]}], "r": [[0.0505035799], 0, 3.1174936294555664, 1580014322.551075], "v": 0.1}
{"i": ["cuda", "logsummul", ["float32"], {}, ["logsummul", "float32"], {"i": 398, "t": "", "c": null, "e": [["y_bn", "ot", 128], ["x_bn", "ot", 32], ["y_t", "ot", 64], ["x_t", "ot", 8], ["k_split", "ot", 16]]}], "r": [[0.0447995596], 0, 3.0476975440979004, 1580014335.0864394], "v": 0.1}
{"i": ["cuda", "logsummul", ["float32"], {}, ["logsummul", "float32"], {"i": 20, "t": "", "c": null, "e": [["y_bn", "ot", 128], ["x_bn", "ot", 32], ["y_t", "ot", 64], ["x_t", "ot", 2], ["k_split", "ot", 1]]}], "r": [[0.0208923099], 0, 2.1357510089874268, 1580014336.2088919], "v": 0.1}
{"i": ["cuda", "logsummul", ["float32"], {}, ["logsummul", "float32"], {"i": 26, "t": "", "c": null, "e": [["y_bn", "ot", 128], ["x_bn", "ot", 128], ["y_t", "ot", 64], ["x_t", "ot", 2], ["k_split", "ot", 1]]}], "r": [[0.0459817946], 0, 3.295330286026001, 1580014338.2108972], "v": 0.1}
{"i": ["cuda", "logsummul", ["float32"], {}, ["logsummul", "float32"], {"i": 190, "t": "", "c": null, "e": [["y_bn", "ot", 64], ["x_bn", "ot", 32], ["y_t", "ot", 8], ["x_t", "ot", 32], ["k_split", "ot", 2]]}], "r": [[0.0275198363], 0, 2.4511895179748535, 1580014340.8421066], "v": 0.1}
{"i": ["cuda", "logsummul", ["float32"], {}, ["logsummul", "float32"], {"i": 417, "t": "", "c": null, "e": [["y_bn", "ot", 32], ["x_bn", "ot", 64], ["y_t", "ot", 32], ["x_t", "ot", 32], ["k_split", "ot", 16]]}], "r": [[0.0847089181], 0, 7.595831632614136, 1580014357.6115558], "v": 0.1}
{"i": ["cuda", "logsummul", ["float32"], {}, ["logsummul", "float32"], {"i": 18, "t": "", "c": null, "e": [["y_bn", "ot", 32], ["x_bn", "ot", 32], ["y_t", "ot", 64], ["x_t", "ot", 2], ["k_split", "ot", 1]]}], "r": [[0.042146466300000004], 0, 2.819143295288086, 1580014359.424732], "v": 0.1}
{"i": ["cuda", "logsummul", ["float32"], {}, ["logsummul", "float32"], {"i": 191, "t": "", "c": null, "e": [["y_bn", "ot", 128], ["x_bn", "ot", 32], ["y_t", "ot", 8], ["x_t", "ot", 32], ["k_split", "ot", 2]]}], "r": [[0.0269873891], 0, 2.4323136806488037, 1580014360.7785091], "v": 0.1}
{"i": ["cuda", "logsummul", ["float32"], {}, ["logsummul", "float32"], {"i": 412, "t": "", "c": null, "e": [["y_bn", "ot", 64], ["x_bn", "ot", 128], ["y_t", "ot", 8], ["x_t", "ot", 32], ["k_split", "ot", 16]]}], "r": [[0.0500312183], 0, 2.866668939590454, 1580014364.1555536], "v": 0.1}
{"i": ["cuda", "logsummul", ["float32"], {}, ["logsummul", "float32"], {"i": 378, "t": "", "c": null, "e": [["y_bn", "ot", 32], ["x_bn", "ot", 32], ["y_t", "ot", 8], ["x_t", "ot", 8], ["k_split", "ot", 16]]}], "r": [[0.028535099200000004], 0, 2.4714505672454834, 1580014365.49494], "v": 0.1}
{"i": ["cuda", "logsummul", ["float32"], {}, ["logsummul", "float32"], {"i": 21, "t": "", "c": null, "e": [["y_bn", "ot", 32], ["x_bn", "ot", 64], ["y_t", "ot", 64], ["x_t", "ot", 2], ["k_split", "ot", 1]]}], "r": [[0.0500020053], 0, 3.0683939456939697, 1580014367.558246], "v": 0.1}
{"i": ["cuda", "logsummul", ["float32"], {}, ["logsummul", "float32"], {"i": 352, "t": "", "c": null, "e": [["y_bn", "ot", 64], ["x_bn", "ot", 32], ["y_t", "ot", 8], ["x_t", "ot", 4], ["k_split", "ot", 16]]}], "r": [[0.0197116764], 0, 2.3739142417907715, 1580014368.811363], "v": 0.1}
{"i": ["cuda", "logsummul", ["float32"], {}, ["logsummul", "float32"], {"i": 96, "t": "", "c": null, "e": [["y_bn", "ot", 32], ["x_bn", "ot", 128], ["y_t", "ot", 32], ["x_t", "ot", 32], ["k_split", "ot", 1]]}], "r": [[0.051797051000000004], 0, 3.030913829803467, 1580072080.8896496], "v": 0.1}
{"i": ["cuda", "logsummul", ["float32"], {}, ["logsummul", "float32"], {"i": 397, "t": "", "c": null, "e": [["y_bn", "ot", 64], ["x_bn", "ot", 32], ["y_t", "ot", 64], ["x_t", "ot", 8], ["k_split", "ot", 16]]}], "r": [[0.080595914], 0, 4.055129528045654, 1580072083.8543677], "v": 0.1}
{"i": ["cuda", "logsummul", ["float32"], {}, ["logsummul", "float32"], {"i": 142, "t": "", "c": null, "e": [["y_bn", "ot", 64], ["x_bn", "ot", 128], ["y_t", "ot", 8], ["x_t", "ot", 4], ["k_split", "ot", 2]]}], "r": [[0.2667573413], 0, 10.328147411346436, 1580072092.7057488], "v": 0.1}
{"i": ["cuda", "logsummul", ["float32"], {}, ["logsummul", "float32"], {"i": 22, "t": "", "c": null, "e": [["y_bn", "ot", 64], ["x_bn", "ot", 64], ["y_t", "ot", 64], ["x_t", "ot", 2], ["k_split", "ot", 1]]}], "r": [[0.0198911443], 0, 2.0909440517425537, 1580072093.7338126], "v": 0.1}
{"i": ["cuda", "logsummul", ["float32"], {}, ["logsummul", "float32"], {"i": 408, "t": "", "c": null, "e": [["y_bn", "ot", 32], ["x_bn", "ot", 64], ["y_t", "ot", 8], ["x_t", "ot", 32], ["k_split", "ot", 16]]}], "r": [[0.0339261898], 0, 2.548987627029419, 1580072095.2620735], "v": 0.1}
{"i": ["cuda", "logsummul", ["float32"], {}, ["logsummul", "float32"], {"i": 241, "t": "", "c": null, "e": [["y_bn", "ot", 64], ["x_bn", "ot", 128], ["y_t", "ot", 64], ["x_t", "ot", 2], ["k_split", "ot", 8]]}], "r": [[0.0234537314], 0, 2.4443106651306152, 1580072098.191212], "v": 0.1}
{"i": ["cuda", "logsummul", ["float32"], {}, ["logsummul", "float32"], {"i": 395, "t": "", "c": null, "e": [["y_bn", "ot", 128], ["x_bn", "ot", 128], ["y_t", "ot", 32], ["x_t", "ot", 8], ["k_split", "ot", 16]]}], "r": [[0.030273069899999998], 0, 2.4150428771972656, 1580072099.5863714], "v": 0.1}
{"i": ["cuda", "logsummul", ["float32"], {}, ["logsummul", "float32"], {"i": 83, "t": "", "c": null, "e": [["y_bn", "ot", 128], ["x_bn", "ot", 32], ["y_t", "ot", 8], ["x_t", "ot", 32], ["k_split", "ot", 1]]}], "r": [[0.0438498393], 0, 2.8031346797943115, 1580072101.470911], "v": 0.1}
{"i": ["cuda", "logsummul", ["float32"], {}, ["logsummul", "float32"], {"i": 86, "t": "", "c": null, "e": [["y_bn", "ot", 128], ["x_bn", "ot", 64], ["y_t", "ot", 8], ["x_t", "ot", 32], ["k_split", "ot", 1]]}], "r": [[0.032199552799999996], 0, 3.9235680103302, 1580072116.5228624], "v": 0.1}
{"i": ["cuda", "logsummul", ["float32"], {}, ["logsummul", "float32"], {"i": 226, "t": "", "c": null, "e": [["y_bn", "ot", 64], ["x_bn", "ot", 32], ["y_t", "ot", 32], ["x_t", "ot", 2], ["k_split", "ot", 8]]}], "r": [[0.0165186997], 0, 2.1407065391540527, 1580072117.5515602], "v": 0.1}
{"i": ["cuda", "logsummul", ["float32"], {}, ["logsummul", "float32"], {"i": 234, "t": "", "c": null, "e": [["y_bn", "ot", 32], ["x_bn", "ot", 32], ["y_t", "ot", 64], ["x_t", "ot", 2], ["k_split", "ot", 8]]}], "r": [[0.047479541199999996], 0, 3.415405511856079, 1580072130.3378954], "v": 0.1}
{"i": ["cuda", "logsummul", ["float32"], {}, ["logsummul", "float32"], {"i": 199, "t": "", "c": null, "e": [["y_bn", "ot", 64], ["x_bn", "ot", 32], ["y_t", "ot", 32], ["x_t", "ot", 32], ["k_split", "ot", 2]]}], "r": [[0.0431592093], 0, 2.8195784091949463, 1580072134.1733124], "v": 0.1}
{"i": ["cuda", "logsummul", ["float32"], {}, ["logsummul", "float32"], {"i": 258, "t": "", "c": null, "e": [["y_bn", "ot", 32], ["x_bn", "ot", 128], ["y_t", "ot", 32], ["x_t", "ot", 4], ["k_split", "ot", 8]]}], "r": [[0.0447113157], 0, 3.0629029273986816, 1580072136.0055652], "v": 0.1}
{"i": ["cuda", "logsummul", ["float32"], {}, ["logsummul", "float32"], {"i": 357, "t": "", "c": null, "e": [["y_bn", "ot", 32], ["x_bn", "ot", 128], ["y_t", "ot", 8], ["x_t", "ot", 4], ["k_split", "ot", 16]]}], "r": [[0.0457923363], 0, 3.491487503051758, 1580072138.1275997], "v": 0.1}
{"i": ["cuda", "logsummul", ["float32"], {}, ["logsummul", "float32"], {"i": 50, "t": "", "c": null, "e": [["y_bn", "ot", 128], ["x_bn", "ot", 64], ["y_t", "ot", 64], ["x_t", "ot", 4], ["k_split", "ot", 1]]}], "r": [[0.0233394032], 0, 2.2668392658233643, 1580072161.5905657], "v": 0.1}
{"i": ["cuda", "logsummul", ["float32"], {}, ["logsummul", "float32"], {"i": 117, "t": "", "c": null, "e": [["y_bn", "ot", 32], ["x_bn", "ot", 32], ["y_t", "ot", 32], ["x_t", "ot", 2], ["k_split", "ot", 2]]}], "r": [[0.0184598332], 0, 2.0020222663879395, 1580072162.5650308], "v": 0.1}
{"i": ["cuda", "logsummul", ["float32"], {}, ["logsummul", "float32"], {"i": 248, "t": "", "c": null, "e": [["y_bn", "ot", 128], ["x_bn", "ot", 64], ["y_t", "ot", 8], ["x_t", "ot", 4], ["k_split", "ot", 8]]}], "r": [[0.2309743344], 0, 9.277791023254395, 1580072170.3827057], "v": 0.1}
{"i": ["cuda", "logsummul", ["float32"], {}, ["logsummul", "float32"], {"i": 80, "t": "", "c": null, "e": [["y_bn", "ot", 128], ["x_bn", "ot", 128], ["y_t", "ot", 64], ["x_t", "ot", 8], ["k_split", "ot", 1]]}], "r": [[0.0325168045], 0, 2.471304178237915, 1580072171.9233909], "v": 0.1}
{"i": ["cuda", "logsummul", ["float32"], {}, ["logsummul", "float32"], {"i": 349, "t": "", "c": null, "e": [["y_bn", "ot", 64], ["x_bn", "ot", 128], ["y_t", "ot", 64], ["x_t", "ot", 2], ["k_split", "ot", 16]]}], "r": [[0.0230784047], 0, 2.5447864532470703, 1580072173.3151026], "v": 0.1}
{"i": ["cuda", "logsummul", ["float32"], {}, ["logsummul", "float32"], {"i": 92, "t": "", "c": null, "e": [["y_bn", "ot", 128], ["x_bn", "ot", 32], ["y_t", "ot", 32], ["x_t", "ot", 32], ["k_split", "ot", 1]]}], "r": [[0.0488299659], 0, 2.9310760498046875, 1580072176.5500455], "v": 0.1}
{"i": ["cuda", "logsummul", ["float32"], {}, ["logsummul", "float32"], {"i": 78, "t": "", "c": null, "e": [["y_bn", "ot", 32], ["x_bn", "ot", 128], ["y_t", "ot", 64], ["x_t", "ot", 8], ["k_split", "ot", 1]]}], "r": [[0.09535440170000001], 0, 4.515597343444824, 1580072180.0092442], "v": 0.1}
{"i": ["cuda", "logsummul", ["float32"], {}, ["logsummul", "float32"], {"i": 176, "t": "", "c": null, "e": [["y_bn", "ot", 128], ["x_bn", "ot", 64], ["y_t", "ot", 32], ["x_t", "ot", 8], ["k_split", "ot", 2]]}], "r": [[0.0234496338], 0, 2.2303500175476074, 1580072181.2490747], "v": 0.1}
{"i": ["cuda", "logsummul", ["float32"], {}, ["logsummul", "float32"], {"i": 168, "t": "", "c": null, "e": [["y_bn", "ot", 32], ["x_bn", "ot", 128], ["y_t", "ot", 8], ["x_t", "ot", 8], ["k_split", "ot", 2]]}], "r": [[0.0315880889], 0, 2.6053900718688965, 1580072182.737963], "v": 0.1}
{"i": ["cuda", "logsummul", ["float32"], {}, ["logsummul", "float32"], {"i": 388, "t": "", "c": null, "e": [["y_bn", "ot", 64], ["x_bn", "ot", 32], ["y_t", "ot", 32], ["x_t", "ot", 8], ["k_split", "ot", 16]]}], "r": [[0.0436970646], 0, 2.7734172344207764, 1580072184.6222432], "v": 0.1}
{"i": ["cuda", "logsummul", ["float32"], {}, ["logsummul", "float32"], {"i": 407, "t": "", "c": null, "e": [["y_bn", "ot", 128], ["x_bn", "ot", 32], ["y_t", "ot", 8], ["x_t", "ot", 32], ["k_split", "ot", 16]]}], "r": [[0.0193062682], 0, 2.0566444396972656, 1580072187.1769006], "v": 0.1}
{"i": ["cuda", "logsummul", ["float32"], {}, ["logsummul", "float32"], {"i": 280, "t": "", "c": null, "e": [["y_bn", "ot", 64], ["x_bn", "ot", 32], ["y_t", "ot", 32], ["x_t", "ot", 8], ["k_split", "ot", 8]]}], "r": [[0.0427811461], 0, 2.7793936729431152, 1580072188.9059496], "v": 0.1}
{"i": ["cuda", "logsummul", ["float32"], {}, ["logsummul", "float32"], {"i": 377, "t": "", "c": null, "e": [["y_bn", "ot", 128], ["x_bn", "ot", 128], ["y_t", "ot", 64], ["x_t", "ot", 4], ["k_split", "ot", 16]]}], "r": [[0.027763417000000002], 0, 2.2213938236236572, 1580072190.175915], "v": 0.1}
{"i": ["cuda", "logsummul", ["float32"], {}, ["logsummul", "float32"], {"i": 48, "t": "", "c": null, "e": [["y_bn", "ot", 32], ["x_bn", "ot", 64], ["y_t", "ot", 64], ["x_t", "ot", 4], ["k_split", "ot", 1]]}], "r": [[0.056263468100000005], 0, 3.39797306060791, 1580072192.4172032], "v": 0.1}
{"i": ["cuda", "logsummul", ["float32"], {}, ["logsummul", "float32"], {"i": 58, "t": "", "c": null, "e": [["y_bn", "ot", 64], ["x_bn", "ot", 64], ["y_t", "ot", 8], ["x_t", "ot", 8], ["k_split", "ot", 1]]}], "r": [[0.0223007571], 0, 2.0787932872772217, 1580072205.5534074], "v": 0.1}
{"i": ["cuda", "logsummul", ["float32"], {}, ["logsummul", "float32"], {"i": 356, "t": "", "c": null, "e": [["y_bn", "ot", 128], ["x_bn", "ot", 64], ["y_t", "ot", 8], ["x_t", "ot", 4], ["k_split", "ot", 16]]}], "r": [[0.22901366699999998], 0, 9.216021060943604, 1580072213.224481], "v": 0.1}
{"i": ["cuda", "logsummul", ["float32"], {}, ["logsummul", "float32"], {"i": 276, "t": "", "c": null, "e": [["y_bn", "ot", 32], ["x_bn", "ot", 128], ["y_t", "ot", 8], ["x_t", "ot", 8], ["k_split", "ot", 8]]}], "r": [[0.0271363174], 0, 2.44179368019104, 1580072214.5387325], "v": 0.1}
{"i": ["cuda", "logsummul", ["float32"], {}, ["logsummul", "float32"], {"i": 152, "t": "", "c": null, "e": [["y_bn", "ot", 128], ["x_bn", "ot", 128], ["y_t", "ot", 32], ["x_t", "ot", 4], ["k_split", "ot", 2]]}], "r": [[0.0491075153], 0, 3.4145424365997314, 1580072216.7916305], "v": 0.1}
{"i": ["cuda", "logsummul", ["float32"], {}, ["logsummul", "float32"], {"i": 91, "t": "", "c": null, "e": [["y_bn", "ot", 64], ["x_bn", "ot", 32], ["y_t", "ot", 32], ["x_t", "ot", 32], ["k_split", "ot", 1]]}], "r": [[0.0700496377], 0, 3.8562355041503906, 1580072219.4423454], "v": 0.1}
{"i": ["cuda", "logsummul", ["float32"], {}, ["logsummul", "float32"], {"i": 111, "t": "", "c": null, "e": [["y_bn", "ot", 32], ["x_bn", "ot", 64], ["y_t", "ot", 8], ["x_t", "ot", 2], ["k_split", "ot", 2]]}], "r": [[0.09182413440000001], 0, 4.648245811462402, 1580072224.2619376], "v": 0.1}
{"i": ["cuda", "logsummul", ["float32"], {}, ["logsummul", "float32"], {"i": 401, "t": "", "c": null, "e": [["y_bn", "ot", 128], ["x_bn", "ot", 64], ["y_t", "ot", 64], ["x_t", "ot", 8], ["k_split", "ot", 16]]}], "r": [[0.044839026500000004], 0, 2.967339277267456, 1580072226.17622], "v": 0.1}
{"i": ["cuda", "logsummul", ["float32"], {}, ["logsummul", "float32"], {"i": 139, "t": "", "c": null, "e": [["y_bn", "ot", 64], ["x_bn", "ot", 64], ["y_t", "ot", 8], ["x_t", "ot", 4], ["k_split", "ot", 2]]}], "r": [[0.0525951438], 0, 3.1938974857330322, 1580072228.2398448], "v": 0.1}
{"i": ["cuda", "logsummul", ["float32"], {}, ["logsummul", "float32"], {"i": 169, "t": "", "c": null, "e": [["y_bn", "ot", 64], ["x_bn", "ot", 128], ["y_t", "ot", 8], ["x_t", "ot", 8], ["k_split", "ot", 2]]}], "r": [[0.0571737261], 0, 3.3181569576263428, 1580072230.4633274], "v": 0.1}
{"i": ["cuda", "logsummul", ["float32"], {}, ["logsummul", "float32"], {"i": 191, "t": "", "c": null, "e": [["y_bn", "ot", 128], ["x_bn", "ot", 32], ["y_t", "ot", 8], ["x_t", "ot", 32], ["k_split", "ot", 2]]}], "r": [[0.0266393145], 0, 2.1190850734710693, 1580072231.73253], "v": 0.1}
{"i": ["cuda", "logsummul", ["float32"], {}, ["logsummul", "float32"], {"i": 188, "t": "", "c": null, "e": [["y_bn", "ot", 128], ["x_bn", "ot", 128], ["y_t", "ot", 64], ["x_t", "ot", 8], ["k_split", "ot", 2]]}], "r": [[0.049090993900000005], 0, 3.0410776138305664, 1580072234.9666808], "v": 0.1}
{"i": ["cuda", "logsummul", ["float32"], {}, ["logsummul", "float32"], {"i": 418, "t": "", "c": null, "e": [["y_bn", "ot", 64], ["x_bn", "ot", 64], ["y_t", "ot", 32], ["x_t", "ot", 32], ["k_split", "ot", 16]]}], "r": [[0.051074608099999995], 0, 3.1334540843963623, 1580072237.0665956], "v": 0.1}
{"i": ["cuda", "logsummul", ["float32"], {}, ["logsummul", "float32"], {"i": 300, "t": "", "c": null, "e": [["y_bn", "ot", 32], ["x_bn", "ot", 64], ["y_t", "ot", 8], ["x_t", "ot", 32], ["k_split", "ot", 8]]}], "r": [[0.022696298900000002], 0, 2.2612252235412598, 1580072238.1928039], "v": 0.1}
{"i": ["cuda", "logsummul", ["float32"], {}, ["logsummul", "float32"], {"i": 394, "t": "", "c": null, "e": [["y_bn", "ot", 64], ["x_bn", "ot", 128], ["y_t", "ot", 32], ["x_t", "ot", 8], ["k_split", "ot", 16]]}], "r": [[0.044074926599999995], 0, 2.785951614379883, 1580072240.0073578], "v": 0.1}
{"i": ["cuda", "logsummul", ["float32"], {}, ["logsummul", "float32"], {"i": 343, "t": "", "c": null, "e": [["y_bn", "ot", 64], ["x_bn", "ot", 32], ["y_t", "ot", 64], ["x_t", "ot", 2], ["k_split", "ot", 16]]}], "r": [[0.0202650789], 0, 2.091188907623291, 1580072241.1458976], "v": 0.1}
{"i": ["cuda", "logsummul", ["float32"], {}, ["logsummul", "float32"], {"i": 132, "t": "", "c": null, "e": [["y_bn", "ot", 32], ["x_bn", "ot", 128], ["y_t", "ot", 64], ["x_t", "ot", 2], ["k_split", "ot", 2]]}], "r": [[0.2117890742], 0, 8.20835828781128, 1580072250.0458858], "v": 0.1}
{"i": ["cuda", "logsummul", ["float32"], {}, ["logsummul", "float32"], {"i": 285, "t": "", "c": null, "e": [["y_bn", "ot", 32], ["x_bn", "ot", 128], ["y_t", "ot", 32], ["x_t", "ot", 8], ["k_split", "ot", 8]]}], "r": [[0.0825776501], 0, 4.121231555938721, 1580072253.0493243], "v": 0.1}
{"i": ["cuda", "logsummul", ["float32"], {}, ["logsummul", "float32"], {"i": 170, "t": "", "c": null, "e": [["y_bn", "ot", 128], ["x_bn", "ot", 128], ["y_t", "ot", 8], ["x_t", "ot", 8], ["k_split", "ot", 2]]}], "r": [[0.2434076378], 0, 9.644668579101562, 1580072261.1722882], "v": 0.1}
{"i": ["cuda", "logsummul", ["float32"], {}, ["logsummul", "float32"], {"i": 222, "t": "", "c": null, "e": [["y_bn", "ot", 32], ["x_bn", "ot", 128], ["y_t", "ot", 8], ["x_t", "ot", 2], ["k_split", "ot", 8]]}], "r": [[0.2916435862], 0, 11.43502926826477, 1580072270.8497427], "v": 0.1}
{"i": ["cuda", "logsummul", ["float32"], {}, ["logsummul", "float32"], {"i": 350, "t": "", "c": null, "e": [["y_bn", "ot", 128], ["x_bn", "ot", 128], ["y_t", "ot", 64], ["x_t", "ot", 2], ["k_split", "ot", 16]]}], "r": [[0.0573363383], 0, 3.519786834716797, 1580072273.0537086], "v": 0.1}
{"i": ["cuda", "logsummul", ["float32"], {}, ["logsummul", "float32"], {"i": 97, "t": "", "c": null, "e": [["y_bn", "ot", 64], ["x_bn", "ot", 128], ["y_t", "ot", 32], ["x_t", "ot", 32], ["k_split", "ot", 1]]}], "r": [[0.044564077800000004], 0, 2.879371166229248, 1580072276.179674], "v": 0.1}
{"i": ["cuda", "logsummul", ["float32"], {}, ["logsummul", "float32"], {"i": 16, "t": "", "c": null, "e": [["y_bn", "ot", 64], ["x_bn", "ot", 128], ["y_t", "ot", 32], ["x_t", "ot", 2], ["k_split", "ot", 1]]}], "r": [[0.0458549063], 0, 3.2454721927642822, 1580072278.2443967], "v": 0.1}
{"i": ["cuda", "logsummul", ["float32"], {}, ["logsummul", "float32"], {"i": 95, "t": "", "c": null, "e": [["y_bn", "ot", 128], ["x_bn", "ot", 64], ["y_t", "ot", 32], ["x_t", "ot", 32], ["k_split", "ot", 1]]}], "r": [[0.0459732302], 0, 2.959902286529541, 1580072280.1270525], "v": 0.1}
{"i": ["cuda", "logsummul", ["float32"], {}, ["logsummul", "float32"], {"i": 49, "t": "", "c": null, "e": [["y_bn", "ot", 64], ["x_bn", "ot", 64], ["y_t", "ot", 64], ["x_t", "ot", 4], ["k_split", "ot", 1]]}], "r": [[0.0289685872], 0, 2.4518823623657227, 1580072281.5476785], "v": 0.1}
{"i": ["cuda", "logsummul", ["float32"], {}, ["logsummul", "float32"], {"i": 346, "t": "", "c": null, "e": [["y_bn", "ot", 64], ["x_bn", "ot", 64], ["y_t", "ot", 64], ["x_t", "ot", 2], ["k_split", "ot", 16]]}], "r": [[0.025370932899999997], 0, 2.3601062297821045, 1580072282.7759871], "v": 0.1}
{"i": ["cuda", "logsummul", ["float32"], {}, ["logsummul", "float32"], {"i": 342, "t": "", "c": null, "e": [["y_bn", "ot", 32], ["x_bn", "ot", 32], ["y_t", "ot", 64], ["x_t", "ot", 2], ["k_split", "ot", 16]]}], "r": [[0.0517887968], 0, 3.137328624725342, 1580072286.595802], "v": 0.1}
{"i": ["cuda", "logsummul", ["float32"], {}, ["logsummul", "float32"], {"i": 411, "t": "", "c": null, "e": [["y_bn", "ot", 32], ["x_bn", "ot", 128], ["y_t", "ot", 8], ["x_t", "ot", 32], ["k_split", "ot", 16]]}], "r": [[0.06410732300000001], 0, 3.5083985328674316, 1580072289.056379], "v": 0.1}
{"i": ["cuda", "logsummul", ["float32"], {}, ["logsummul", "float32"], {"i": 47, "t": "", "c": null, "e": [["y_bn", "ot", 128], ["x_bn", "ot", 32], ["y_t", "ot", 64], ["x_t", "ot", 4], ["k_split", "ot", 1]]}], "r": [[0.0221808404], 0, 2.3364102840423584, 1580072290.249715], "v": 0.1}
{"i": ["cuda", "logsummul", ["float32"], {}, ["logsummul", "float32"], {"i": 345, "t": "", "c": null, "e": [["y_bn", "ot", 32], ["x_bn", "ot", 64], ["y_t", "ot", 64], ["x_t", "ot", 2], ["k_split", "ot", 16]]}], "r": [[0.0522555388], 0, 4.594193935394287, 1580072304.0249934], "v": 0.1}
{"i": ["cuda", "logsummul", ["float32"], {}, ["logsummul", "float32"], {"i": 269, "t": "", "c": null, "e": [["y_bn", "ot", 128], ["x_bn", "ot", 128], ["y_t", "ot", 64], ["x_t", "ot", 4], ["k_split", "ot", 8]]}], "r": [[0.0268923897], 0, 2.1615891456604004, 1580072306.8151143], "v": 0.1}
{"i": ["cuda", "logsummul", ["float32"], {}, ["logsummul", "float32"], {"i": 399, "t": "", "c": null, "e": [["y_bn", "ot", 32], ["x_bn", "ot", 64], ["y_t", "ot", 64], ["x_t", "ot", 8], ["k_split", "ot", 16]]}], "r": [[0.1664651627], 0, 6.563208103179932, 1580072312.4166803], "v": 0.1}
{"i": ["cuda", "logsummul", ["float32"], {}, ["logsummul", "float32"], {"i": 368, "t": "", "c": null, "e": [["y_bn", "ot", 128], ["x_bn", "ot", 128], ["y_t", "ot", 32], ["x_t", "ot", 4], ["k_split", "ot", 16]]}], "r": [[0.0453267031], 0, 3.2623634338378906, 1580072314.4921558], "v": 0.1}
{"i": ["cuda", "logsummul", ["float32"], {}, ["logsummul", "float32"], {"i": 31, "t": "", "c": null, "e": [["y_bn", "ot", 64], ["x_bn", "ot", 64], ["y_t", "ot", 8], ["x_t", "ot", 4], ["k_split", "ot", 1]]}], "r": [[0.048615551800000004], 0, 2.979102849960327, 1580072316.461291], "v": 0.1}
{"i": ["cuda", "logsummul", ["float32"], {}, ["logsummul", "float32"], {"i": 204, "t": "", "c": null, "e": [["y_bn", "ot", 32], ["x_bn", "ot", 128], ["y_t", "ot", 32], ["x_t", "ot", 32], ["k_split", "ot", 2]]}], "r": [[0.0416127061], 0, 2.507736921310425, 1580072319.2504466], "v": 0.1}
{"i": ["cuda", "logsummul", ["float32"], {}, ["logsummul", "float32"], {"i": 312, "t": "", "c": null, "e": [["y_bn", "ot", 32], ["x_bn", "ot", 128], ["y_t", "ot", 32], ["x_t", "ot", 32], ["k_split", "ot", 8]]}], "r": [[0.0904884723], 0, 4.1303393840789795, 1580072322.540367], "v": 0.1}
{"i": ["cuda", "logsummul", ["float32"], {}, ["logsummul", "float32"], {"i": 173, "t": "", "c": null, "e": [["y_bn", "ot", 128], ["x_bn", "ot", 32], ["y_t", "ot", 32], ["x_t", "ot", 8], ["k_split", "ot", 2]]}], "r": [[0.0199573895], 0, 2.0286972522735596, 1580072323.7104208], "v": 0.1}
{"i": ["cuda", "logsummul", ["float32"], {}, ["logsummul", "float32"], {"i": 59, "t": "", "c": null, "e": [["y_bn", "ot", 128], ["x_bn", "ot", 64], ["y_t", "ot", 8], ["x_t", "ot", 8], ["k_split", "ot", 1]]}], "r": [[0.05084289360000001], 0, 3.3503761291503906, 1580072327.2498999], "v": 0.1}
{"i": ["cuda", "logsummul", ["float32"], {}, ["logsummul", "float32"], {"i": 75, "t": "", "c": null, "e": [["y_bn", "ot", 32], ["x_bn", "ot", 64], ["y_t", "ot", 64], ["x_t", "ot", 8], ["k_split", "ot", 1]]}], "r": [[0.0679393813], 0, 3.746891736984253, 1580072329.853777], "v": 0.1}
{"i": ["cuda", "logsummul", ["float32"], {}, ["logsummul", "float32"], {"i": 290, "t": "", "c": null, "e": [["y_bn", "ot", 128], ["x_bn", "ot", 32], ["y_t", "ot", 64], ["x_t", "ot", 8], ["k_split", "ot", 8]]}], "r": [[0.0442566097], 0, 2.807758331298828, 1580072331.672678], "v": 0.1}
{"i": ["cuda", "logsummul", ["float32"], {}, ["logsummul", "float32"], {"i": 0, "t": "", "c": null, "e": [["y_bn", "ot", 32], ["x_bn", "ot", 32], ["y_t", "ot", 8], ["x_t", "ot", 2], ["k_split", "ot", 1]]}], "r": [[0.0397071369], 0, 2.806434154510498, 1580072333.350567], "v": 0.1}
{"i": ["cuda", "logsummul", ["float32"], {}, ["logsummul", "float32"], {"i": 164, "t": "", "c": null, "e": [["y_bn", "ot", 128], ["x_bn", "ot", 32], ["y_t", "ot", 8], ["x_t", "ot", 8], ["k_split", "ot", 2]]}], "r": [[0.0212725285], 0, 2.2295877933502197, 1580072334.4636998], "v": 0.1}
{"i": ["cuda", "logsummul", ["float32"], {}, ["logsummul", "float32"], {"i": 268, "t": "", "c": null, "e": [["y_bn", "ot", 64], ["x_bn", "ot", 128], ["y_t", "ot", 64], ["x_t", "ot", 4], ["k_split", "ot", 8]]}], "r": [[0.0449943416], 0, 2.8519091606140137, 1580072337.530668], "v": 0.1}
{"i": ["cuda", "logsummul", ["float32"], {}, ["logsummul", "float32"], {"i": 187, "t": "", "c": null, "e": [["y_bn", "ot", 64], ["x_bn", "ot", 128], ["y_t", "ot", 64], ["x_t", "ot", 8], ["k_split", "ot", 2]]}], "r": [[0.0846896474], 0, 4.207021474838257, 1580072340.6782641], "v": 0.1}
{"i": ["cuda", "logsummul", ["float32"], {}, ["logsummul", "float32"], {"i": 308, "t": "", "c": null, "e": [["y_bn", "ot", 128], ["x_bn", "ot", 32], ["y_t", "ot", 32], ["x_t", "ot", 32], ["k_split", "ot", 8]]}], "r": [[0.026837952199999997], 0, 2.244558811187744, 1580072342.0205698], "v": 0.1}
{"i": ["cuda", "logsummul", ["float32"], {}, ["logsummul", "float32"], {"i": 245, "t": "", "c": null, "e": [["y_bn", "ot", 128], ["x_bn", "ot", 32], ["y_t", "ot", 8], ["x_t", "ot", 4], ["k_split", "ot", 8]]}], "r": [[0.0515287664], 0, 6.456151962280273, 1580072369.540197], "v": 0.1}
{"i": ["cuda", "logsummul", ["float32"], {}, ["logsummul", "float32"], {"i": 85, "t": "", "c": null, "e": [["y_bn", "ot", 64], ["x_bn", "ot", 64], ["y_t", "ot", 8], ["x_t", "ot", 32], ["k_split", "ot", 1]]}], "r": [[0.0366728469], 0, 2.5756287574768066, 1580072371.1474452], "v": 0.1}
{"i": ["cuda", "logsummul", ["float32"], {}, ["logsummul", "float32"], {"i": 177, "t": "", "c": null, "e": [["y_bn", "ot", 32], ["x_bn", "ot", 128], ["y_t", "ot", 32], ["x_t", "ot", 8], ["k_split", "ot", 2]]}], "r": [[0.086503724], 0, 4.124898195266724, 1580072374.2458642], "v": 0.1}
{"i": ["cuda", "logsummul", ["float32"], {}, ["logsummul", "float32"], {"i": 220, "t": "", "c": null, "e": [["y_bn", "ot", 64], ["x_bn", "ot", 64], ["y_t", "ot", 8], ["x_t", "ot", 2], ["k_split", "ot", 8]]}], "r": [[0.2877268261], 0, 10.982158184051514, 1580072383.6387198], "v": 0.1}
{"i": ["cuda", "logsummul", ["float32"], {}, ["logsummul", "float32"], {"i": 137, "t": "", "c": null, "e": [["y_bn", "ot", 128], ["x_bn", "ot", 32], ["y_t", "ot", 8], ["x_t", "ot", 4], ["k_split", "ot", 2]]}], "r": [[0.057756060899999996], 0, 3.6690480709075928, 1580072387.4662175], "v": 0.1}
{"i": ["cuda", "logsummul", ["float32"], {}, ["logsummul", "float32"], {"i": 146, "t": "", "c": null, "e": [["y_bn", "ot", 128], ["x_bn", "ot", 32], ["y_t", "ot", 32], ["x_t", "ot", 4], ["k_split", "ot", 2]]}], "r": [[0.0184397924], 0, 2.2437214851379395, 1580072388.5334694], "v": 0.1}
{"i": ["cuda", "logsummul", ["float32"], {}, ["logsummul", "float32"], {"i": 68, "t": "", "c": null, "e": [["y_bn", "ot", 128], ["x_bn", "ot", 64], ["y_t", "ot", 32], ["x_t", "ot", 8], ["k_split", "ot", 1]]}], "r": [[0.0239561586], 0, 2.074967861175537, 1580072389.7980707], "v": 0.1}
{"i": ["cuda", "logsummul", ["float32"], {}, ["logsummul", "float32"], {"i": 336, "t": "", "c": null, "e": [["y_bn", "ot", 32], ["x_bn", "ot", 64], ["y_t", "ot", 32], ["x_t", "ot", 2], ["k_split", "ot", 16]]}], "r": [[0.025012925800000002], 0, 2.4124841690063477, 1580072391.156623], "v": 0.1}
{"i": ["cuda", "logsummul", ["float32"], {}, ["logsummul", "float32"], {"i": 372, "t": "", "c": null, "e": [["y_bn", "ot", 32], ["x_bn", "ot", 64], ["y_t", "ot", 64], ["x_t", "ot", 4], ["k_split", "ot", 16]]}], "r": [[0.0836531849], 0, 4.092067718505859, 1580072394.1793537], "v": 0.1}
{"i": ["cuda", "logsummul", ["float32"], {}, ["logsummul", "float32"], {"i": 63, "t": "", "c": null, "e": [["y_bn", "ot", 32], ["x_bn", "ot", 32], ["y_t", "ot", 32], ["x_t", "ot", 8], ["k_split", "ot", 1]]}], "r": [[0.0319280559], 0, 2.3751888275146484, 1580072396.8223653], "v": 0.1}
{"i": ["cuda", "logsummul", ["float32"], {}, ["logsummul", "float32"], {"i": 126, "t": "", "c": null, "e": [["y_bn", "ot", 32], ["x_bn", "ot", 32], ["y_t", "ot", 64], ["x_t", "ot", 2], ["k_split", "ot", 2]]}], "r": [[0.043549480200000004], 0, 2.75327205657959, 1580072398.707996], "v": 0.1}
{"i": ["cuda", "logsummul", ["float32"], {}, ["logsummul", "float32"], {"i": 306, "t": "", "c": null, "e": [["y_bn", "ot", 32], ["x_bn", "ot", 32], ["y_t", "ot", 32], ["x_t", "ot", 32], ["k_split", "ot", 8]]}], "r": [[0.0393595495], 0, 2.7205286026000977, 1580072400.4327111], "v": 0.1}
{"i": ["cuda", "logsummul", ["float32"], {}, ["logsummul", "float32"], {"i": 413, "t": "", "c": null, "e": [["y_bn", "ot", 128], ["x_bn", "ot", 128], ["y_t", "ot", 8], ["x_t", "ot", 32], ["k_split", "ot", 16]]}], "r": [[0.036538823], 0, 2.6594080924987793, 1580072402.109794], "v": 0.1}
{"i": ["cuda", "logsummul", ["float32"], {}, ["logsummul", "float32"], {"i": 306, "t": "", "c": null, "e": [["y_bn", "ot", 32], ["x_bn", "ot", 32], ["y_t", "ot", 32], ["x_t", "ot", 32], ["k_split", "ot", 8]]}], "r": [[0.038201437], 0, 2.7570607662200928, 1580079108.3182437], "v": 0.1}
{"i": ["cuda", "logsummul", ["float32"], {}, ["logsummul", "float32"], {"i": 290, "t": "", "c": null, "e": [["y_bn", "ot", 128], ["x_bn", "ot", 32], ["y_t", "ot", 64], ["x_t", "ot", 8], ["k_split", "ot", 8]]}], "r": [[0.0433731132], 0, 3.5060782432556152, 1580079120.9638581], "v": 0.1}
{"i": ["cuda", "logsummul", ["float32"], {}, ["logsummul", "float32"], {"i": 228, "t": "", "c": null, "e": [["y_bn", "ot", 32], ["x_bn", "ot", 64], ["y_t", "ot", 32], ["x_t", "ot", 2], ["k_split", "ot", 8]]}], "r": [[0.018317512799999998], 0, 2.2707808017730713, 1580079122.025392], "v": 0.1}
{"i": ["cuda", "logsummul", ["float32"], {}, ["logsummul", "float32"], {"i": 84, "t": "", "c": null, "e": [["y_bn", "ot", 32], ["x_bn", "ot", 64], ["y_t", "ot", 8], ["x_t", "ot", 32], ["k_split", "ot", 1]]}], "r": [[0.0471888887], 0, 2.795055866241455, 1580079123.9368145], "v": 0.1}
{"i": ["cuda", "logsummul", ["float32"], {}, ["logsummul", "float32"], {"i": 266, "t": "", "c": null, "e": [["y_bn", "ot", 128], ["x_bn", "ot", 64], ["y_t", "ot", 64], ["x_t", "ot", 4], ["k_split", "ot", 8]]}], "r": [[0.0245955006], 0, 2.2687740325927734, 1580079126.357825], "v": 0.1}
{"i": ["cuda", "logsummul", ["float32"], {}, ["logsummul", "float32"], {"i": 226, "t": "", "c": null, "e": [["y_bn", "ot", 64], ["x_bn", "ot", 32], ["y_t", "ot", 32], ["x_t", "ot", 2], ["k_split", "ot", 8]]}], "r": [[0.016592970800000002], 0, 1.9336614608764648, 1580079127.3428116], "v": 0.1}
{"i": ["cuda", "logsummul", ["float32"], {}, ["logsummul", "float32"], {"i": 164, "t": "", "c": null, "e": [["y_bn", "ot", 128], ["x_bn", "ot", 32], ["y_t", "ot", 8], ["x_t", "ot", 8], ["k_split", "ot", 2]]}], "r": [[0.0211717401], 0, 2.2240428924560547, 1580079128.4590318], "v": 0.1}
{"i": ["cuda", "logsummul", ["float32"], {}, ["logsummul", "float32"], {"i": 93, "t": "", "c": null, "e": [["y_bn", "ot", 32], ["x_bn", "ot", 64], ["y_t", "ot", 32], ["x_t", "ot", 32], ["k_split", "ot", 1]]}], "r": [[0.0723236404], 0, 3.7561988830566406, 1580079131.1959107], "v": 0.1}
{"i": ["cuda", "logsummul", ["float32"], {}, ["logsummul", "float32"], {"i": 147, "t": "", "c": null, "e": [["y_bn", "ot", 32], ["x_bn", "ot", 64], ["y_t", "ot", 32], ["x_t", "ot", 4], ["k_split", "ot", 2]]}], "r": [[0.042869192900000005], 0, 2.9085285663604736, 1580079133.069772], "v": 0.1}
{"i": ["cuda", "logsummul", ["float32"], {}, ["logsummul", "float32"], {"i": 186, "t": "", "c": null, "e": [["y_bn", "ot", 32], ["x_bn", "ot", 128], ["y_t", "ot", 64], ["x_t", "ot", 8], ["k_split", "ot", 2]]}], "r": [[0.1964117393], 0, 7.581350803375244, 1580079140.8270485], "v": 0.1}
{"i": ["cuda", "logsummul", ["float32"], {}, ["logsummul", "float32"], {"i": 156, "t": "", "c": null, "e": [["y_bn", "ot", 32], ["x_bn", "ot", 64], ["y_t", "ot", 64], ["x_t", "ot", 4], ["k_split", "ot", 2]]}], "r": [[0.0974892862], 0, 4.549231290817261, 1580079144.3387914], "v": 0.1}
{"i": ["cuda", "logsummul", ["float32"], {}, ["logsummul", "float32"], {"i": 48, "t": "", "c": null, "e": [["y_bn", "ot", 32], ["x_bn", "ot", 64], ["y_t", "ot", 64], ["x_t", "ot", 4], ["k_split", "ot", 1]]}], "r": [[0.0553016646], 0, 3.1875312328338623, 1580079146.5270534], "v": 0.1}
{"i": ["cuda", "logsummul", ["float32"], {}, ["logsummul", "float32"], {"i": 377, "t": "", "c": null, "e": [["y_bn", "ot", 128], ["x_bn", "ot", 128], ["y_t", "ot", 64], ["x_t", "ot", 4], ["k_split", "ot", 16]]}], "r": [[0.0275039776], 0, 2.3357837200164795, 1580079147.854361], "v": 0.1}
{"i": ["cuda", "logsummul", ["float32"], {}, ["logsummul", "float32"], {"i": 66, "t": "", "c": null, "e": [["y_bn", "ot", 32], ["x_bn", "ot", 64], ["y_t", "ot", 32], ["x_t", "ot", 8], ["k_split", "ot", 1]]}], "r": [[0.0323855038], 0, 2.563699960708618, 1580079149.3856359], "v": 0.1}
{"i": ["cuda", "logsummul", ["float32"], {}, ["logsummul", "float32"], {"i": 166, "t": "", "c": null, "e": [["y_bn", "ot", 64], ["x_bn", "ot", 64], ["y_t", "ot", 8], ["x_t", "ot", 8], ["k_split", "ot", 2]]}], "r": [[0.020127787299999998], 0, 2.230100631713867, 1580079152.0837018], "v": 0.1}
{"i": ["cuda", "logsummul", ["float32"], {}, ["logsummul", "float32"], {"i": 389, "t": "", "c": null, "e": [["y_bn", "ot", 128], ["x_bn", "ot", 32], ["y_t", "ot", 32], ["x_t", "ot", 8], ["k_split", "ot", 16]]}], "r": [[0.028160422299999998], 0, 6.557418584823608, 1580079167.7263625], "v": 0.1}
{"i": ["cuda", "logsummul", ["float32"], {}, ["logsummul", "float32"], {"i": 138, "t": "", "c": null, "e": [["y_bn", "ot", 32], ["x_bn", "ot", 64], ["y_t", "ot", 8], ["x_t", "ot", 4], ["k_split", "ot", 2]]}], "r": [[0.0217633768], 0, 2.4488043785095215, 1580079169.0345185], "v": 0.1}
{"i": ["cuda", "logsummul", ["float32"], {}, ["logsummul", "float32"], {"i": 420, "t": "", "c": null, "e": [["y_bn", "ot", 32], ["x_bn", "ot", 128], ["y_t", "ot", 32], ["x_t", "ot", 32], ["k_split", "ot", 16]]}], "r": [[0.0857790176], 0, 4.19834566116333, 1580079172.2182624], "v": 0.1}
{"i": ["cuda", "logsummul", ["float32"], {}, ["logsummul", "float32"], {"i": 61, "t": "", "c": null, "e": [["y_bn", "ot", 64], ["x_bn", "ot", 128], ["y_t", "ot", 8], ["x_t", "ot", 8], ["k_split", "ot", 1]]}], "r": [[0.051720616600000005], 0, 3.3919334411621094, 1580079175.9333107], "v": 0.1}
{"i": ["cuda", "logsummul", ["float32"], {}, ["logsummul", "float32"], {"i": 10, "t": "", "c": null, "e": [["y_bn", "ot", 64], ["x_bn", "ot", 32], ["y_t", "ot", 32], ["x_t", "ot", 2], ["k_split", "ot", 1]]}], "r": [[0.0203708137], 0, 2.1055092811584473, 1580079177.0665784], "v": 0.1}
{"i": ["cuda", "logsummul", ["float32"], {}, ["logsummul", "float32"], {"i": 21, "t": "", "c": null, "e": [["y_bn", "ot", 32], ["x_bn", "ot", 64], ["y_t", "ot", 64], ["x_t", "ot", 2], ["k_split", "ot", 1]]}], "r": [[0.0494606098], 0, 3.0917787551879883, 1580079179.0178902], "v": 0.1}
{"i": ["cuda", "logsummul", ["float32"], {}, ["logsummul", "float32"], {"i": 275, "t": "", "c": null, "e": [["y_bn", "ot", 128], ["x_bn", "ot", 64], ["y_t", "ot", 8], ["x_t", "ot", 8], ["k_split", "ot", 8]]}], "r": [[0.0499313817], 0, 3.4681291580200195, 1580079181.2155976], "v": 0.1}
{"i": ["cuda", "logsummul", ["float32"], {}, ["logsummul", "float32"], {"i": 365, "t": "", "c": null, "e": [["y_bn", "ot", 128], ["x_bn", "ot", 64], ["y_t", "ot", 32], ["x_t", "ot", 4], ["k_split", "ot", 16]]}], "r": [[0.019545544800000002], 0, 2.490539789199829, 1580079182.4876091], "v": 0.1}
{"i": ["cuda", "logsummul", ["float32"], {}, ["logsummul", "float32"], {"i": 75, "t": "", "c": null, "e": [["y_bn", "ot", 32], ["x_bn", "ot", 64], ["y_t", "ot", 64], ["x_t", "ot", 8], ["k_split", "ot", 1]]}], "r": [[0.0678425714], 0, 3.523836851119995, 1580079186.3814929], "v": 0.1}
{"i": ["cuda", "logsummul", ["float32"], {}, ["logsummul", "float32"], {"i": 187, "t": "", "c": null, "e": [["y_bn", "ot", 64], ["x_bn", "ot", 128], ["y_t", "ot", 64], ["x_t", "ot", 8], ["k_split", "ot", 2]]}], "r": [[0.0845955122], 0, 4.1428093910217285, 1580079189.446524], "v": 0.1}
{"i": ["cuda", "logsummul", ["float32"], {}, ["logsummul", "float32"], {"i": 44, "t": "", "c": null, "e": [["y_bn", "ot", 128], ["x_bn", "ot", 128], ["y_t", "ot", 32], ["x_t", "ot", 4], ["k_split", "ot", 1]]}], "r": [[0.051992978], 0, 3.361872434616089, 1580079191.7301102], "v": 0.1}
{"i": ["cuda", "logsummul", ["float32"], {}, ["logsummul", "float32"], {"i": 334, "t": "", "c": null, "e": [["y_bn", "ot", 64], ["x_bn", "ot", 32], ["y_t", "ot", 32], ["x_t", "ot", 2], ["k_split", "ot", 16]]}], "r": [[0.018283312500000003], 0, 2.29738450050354, 1580079192.8402896], "v": 0.1}
{"i": ["cuda", "logsummul", ["float32"], {}, ["logsummul", "float32"], {"i": 413, "t": "", "c": null, "e": [["y_bn", "ot", 128], ["x_bn", "ot", 128], ["y_t", "ot", 8], ["x_t", "ot", 32], ["k_split", "ot", 16]]}], "r": [[0.035945593799999995], 0, 2.6091361045837402, 1580079194.4119527], "v": 0.1}
{"i": ["cuda", "logsummul", ["float32"], {}, ["logsummul", "float32"], {"i": 248, "t": "", "c": null, "e": [["y_bn", "ot", 128], ["x_bn", "ot", 64], ["y_t", "ot", 8], ["x_t", "ot", 4], ["k_split", "ot", 8]]}], "r": [[0.23102325750000002], 0, 9.137195110321045, 1580079203.7155747], "v": 0.1}
{"i": ["cuda", "logsummul", ["float32"], {}, ["logsummul", "float32"], {"i": 258, "t": "", "c": null, "e": [["y_bn", "ot", 32], ["x_bn", "ot", 128], ["y_t", "ot", 32], ["x_t", "ot", 4], ["k_split", "ot", 8]]}], "r": [[0.045533093499999996], 0, 2.952500104904175, 1580079205.611428], "v": 0.1}
{"i": ["cuda", "logsummul", ["float32"], {}, ["logsummul", "float32"], {"i": 421, "t": "", "c": null, "e": [["y_bn", "ot", 64], ["x_bn", "ot", 128], ["y_t", "ot", 32], ["x_t", "ot", 32], ["k_split", "ot", 16]]}], "r": [[0.0643989347], 0, 3.489433526992798, 1580079208.073294], "v": 0.1}
{"i": ["cuda", "logsummul", ["float32"], {}, ["logsummul", "float32"], {"i": 240, "t": "", "c": null, "e": [["y_bn", "ot", 32], ["x_bn", "ot", 128], ["y_t", "ot", 64], ["x_t", "ot", 2], ["k_split", "ot", 8]]}], "r": [[0.1760314352], 0, 6.990728139877319, 1580079214.056295], "v": 0.1}
{"i": ["cuda", "logsummul", ["float32"], {}, ["logsummul", "float32"], {"i": 298, "t": "", "c": null, "e": [["y_bn", "ot", 64], ["x_bn", "ot", 32], ["y_t", "ot", 8], ["x_t", "ot", 32], ["k_split", "ot", 8]]}], "r": [[0.0185682539], 0, 2.2323029041290283, 1580079215.1432824], "v": 0.1}
{"i": ["cuda", "logsummul", ["float32"], {}, ["logsummul", "float32"], {"i": 68, "t": "", "c": null, "e": [["y_bn", "ot", 128], ["x_bn", "ot", 64], ["y_t", "ot", 32], ["x_t", "ot", 8], ["k_split", "ot", 1]]}], "r": [[0.0239242487], 0, 2.2431817054748535, 1580079217.7632065], "v": 0.1}
{"i": ["cuda", "logsummul", ["float32"], {}, ["logsummul", "float32"], {"i": 295, "t": "", "c": null, "e": [["y_bn", "ot", 64], ["x_bn", "ot", 128], ["y_t", "ot", 64], ["x_t", "ot", 8], ["k_split", "ot", 8]]}], "r": [[0.0846734824], 0, 4.368969678878784, 1580079220.9627879], "v": 0.1}
{"i": ["cuda", "logsummul", ["float32"], {}, ["logsummul", "float32"], {"i": 206, "t": "", "c": null, "e": [["y_bn", "ot", 128], ["x_bn", "ot", 128], ["y_t", "ot", 32], ["x_t", "ot", 32], ["k_split", "ot", 2]]}], "r": [[0.0281177952], 0, 2.3740828037261963, 1580079222.2869432], "v": 0.1}
{"i": ["cuda", "logsummul", ["float32"], {}, ["logsummul", "float32"], {"i": 0, "t": "", "c": null, "e": [["y_bn", "ot", 32], ["x_bn", "ot", 32], ["y_t", "ot", 8], ["x_t", "ot", 2], ["k_split", "ot", 1]]}], "r": [[0.0397029972], 0, 2.6326754093170166, 1580079223.936831], "v": 0.1}
{"i": ["cuda", "logsummul", ["float32"], {}, ["logsummul", "float32"], {"i": 277, "t": "", "c": null, "e": [["y_bn", "ot", 64], ["x_bn", "ot", 128], ["y_t", "ot", 8], ["x_t", "ot", 8], ["k_split", "ot", 8]]}], "r": [[0.0522819017], 0, 3.481445074081421, 1580079226.1327016], "v": 0.1}
{"i": ["cuda", "logsummul", ["float32"], {}, ["logsummul", "float32"], {"i": 227, "t": "", "c": null, "e": [["y_bn", "ot", 128], ["x_bn", "ot", 32], ["y_t", "ot", 32], ["x_t", "ot", 2], ["k_split", "ot", 8]]}], "r": [[0.0189742086], 0, 2.1011292934417725, 1580079228.4274507], "v": 0.1}
{"i": ["cuda", "logsummul", ["float32"], {}, ["logsummul", "float32"], {"i": 52, "t": "", "c": null, "e": [["y_bn", "ot", 64], ["x_bn", "ot", 128], ["y_t", "ot", 64], ["x_t", "ot", 4], ["k_split", "ot", 1]]}], "r": [[0.0464194386], 0, 2.8517727851867676, 1580079230.3260207], "v": 0.1}
{"i": ["cuda", "logsummul", ["float32"], {}, ["logsummul", "float32"], {"i": 92, "t": "", "c": null, "e": [["y_bn", "ot", 128], ["x_bn", "ot", 32], ["y_t", "ot", 32], ["x_t", "ot", 32], ["k_split", "ot", 1]]}], "r": [[0.048817546], 0, 2.811021566390991, 1580079232.2514155], "v": 0.1}
{"i": ["cuda", "logsummul", ["float32"], {}, ["logsummul", "float32"], {"i": 158, "t": "", "c": null, "e": [["y_bn", "ot", 128], ["x_bn", "ot", 64], ["y_t", "ot", 64], ["x_t", "ot", 4], ["k_split", "ot", 2]]}], "r": [[0.0268430337], 0, 2.2837882041931152, 1580079233.499307], "v": 0.1}
{"i": ["cuda", "logsummul", ["float32"], {}, ["logsummul", "float32"], {"i": 363, "t": "", "c": null, "e": [["y_bn", "ot", 32], ["x_bn", "ot", 64], ["y_t", "ot", 32], ["x_t", "ot", 4], ["k_split", "ot", 16]]}], "r": [[0.0430291437], 0, 2.8055520057678223, 1580079236.4707682], "v": 0.1}
{"i": ["cuda", "logsummul", ["float32"], {}, ["logsummul", "float32"], {"i": 71, "t": "", "c": null, "e": [["y_bn", "ot", 128], ["x_bn", "ot", 128], ["y_t", "ot", 32], ["x_t", "ot", 8], ["k_split", "ot", 1]]}], "r": [[0.029030016], 0, 2.3394036293029785, 1580079237.8135796], "v": 0.1}
{"i": ["cuda", "logsummul", ["float32"], {}, ["logsummul", "float32"], {"i": 151, "t": "", "c": null, "e": [["y_bn", "ot", 64], ["x_bn", "ot", 128], ["y_t", "ot", 32], ["x_t", "ot", 4], ["k_split", "ot", 2]]}], "r": [[0.0262569616], 0, 2.353149652481079, 1580079239.1447408], "v": 0.1}
{"i": ["cuda", "logsummul", ["float32"], {}, ["logsummul", "float32"], {"i": 238, "t": "", "c": null, "e": [["y_bn", "ot", 64], ["x_bn", "ot", 64], ["y_t", "ot", 64], ["x_t", "ot", 2], ["k_split", "ot", 8]]}], "r": [[0.0269388303], 0, 2.3711233139038086, 1580079240.501346], "v": 0.1}
{"i": ["cuda", "logsummul", ["float32"], {}, ["logsummul", "float32"], {"i": 403, "t": "", "c": null, "e": [["y_bn", "ot", 64], ["x_bn", "ot", 128], ["y_t", "ot", 64], ["x_t", "ot", 8], ["k_split", "ot", 16]]}], "r": [[0.0835911709], 0, 4.098693370819092, 1580079243.5512183], "v": 0.1}
{"i": ["cuda", "logsummul", ["float32"], {}, ["logsummul", "float32"], {"i": 286, "t": "", "c": null, "e": [["y_bn", "ot", 64], ["x_bn", "ot", 128], ["y_t", "ot", 32], ["x_t", "ot", 8], ["k_split", "ot", 8]]}], "r": [[0.0434228338], 0, 2.722032308578491, 1580079246.4493606], "v": 0.1}
{"i": ["cuda", "logsummul", ["float32"], {}, ["logsummul", "float32"], {"i": 76, "t": "", "c": null, "e": [["y_bn", "ot", 64], ["x_bn", "ot", 64], ["y_t", "ot", 64], ["x_t", "ot", 8], ["k_split", "ot", 1]]}], "r": [[0.0369320563], 0, 2.4029388427734375, 1580079248.0584254], "v": 0.1}
{"i": ["cuda", "logsummul", ["float32"], {}, ["logsummul", "float32"], {"i": 307, "t": "", "c": null, "e": [["y_bn", "ot", 64], ["x_bn", "ot", 32], ["y_t", "ot", 32], ["x_t", "ot", 32], ["k_split", "ot", 8]]}], "r": [[0.0254705089], 0, 2.110016345977783, 1580079249.3755243], "v": 0.1}
